{
  "api_version": "agent-platform/v1alpha1",
  "kind": "SkillManifest",
  "metadata": {
    "id": "skl_0198f6d0-7ef0-7b0e-a0d3-5f9c96c7f411",
    "key": "code-review-skill",
    "namespace": "development",
    "version": "1.0.0",
    "revision": 1,
    "scope": {
      "type": "tenant",
      "tenant_id": "ten_0198f6d0-7ef0-7b0e-a0d3-5f9c96c7f411"
    },
    "labels": {
      "domain": "development",
      "category": "code_quality"
    },
    "annotations": {},
    "content_digest": "sha256:a1b2c3d4e5f6a1b2c3d4e5f6a1b2c3d4e5f6a1b2c3d4e5f6a1b2c3d4e5f6a1b2",
    "created_at": "2026-09-01T00:00:00Z",
    "created_by": {
      "actor_type": "user",
      "actor_id": "usr_0198f6d0-7ef0-7b0e-a0d3-5f9c96c7f411",
      "tenant_id": "ten_0198f6d0-7ef0-7b0e-a0d3-5f9c96c7f411"
    }
  },
  "spec": {
    "portable_name": "code-review-skill",
    "description": "This skill performs automated code review with security checks, identifying potential vulnerabilities, code quality issues, and best practice violations in the codebase.",
    "domain": ["development", "security"],
    "tags": ["code-review", "security", "quality"],
    "trigger_examples": {
      "positive": [
        "Review this code for security issues",
        "Check if this function has vulnerabilities",
        "Analyze code quality and suggest improvements",
        "Perform a security audit on this module"
      ],
      "negative": [
        "Write new code for this feature",
        "Deploy this application to production",
        "Run the test suite",
        "Create a new branch"
      ]
    },
    "required_tools": [
      {
        "tool_ref": {
          "kind": "ToolManifest",
          "id": "tol_0198f6d0-7ef0-7b0e-a0d3-5f9c96c7f411",
          "version": "1.0.0",
          "digest": "sha256:b2c3d4e5f6a1b2c3d4e5f6a1b2c3d4e5f6a1b2c3d4e5f6a1b2c3d4e5f6a1b2c3"
        },
        "required_capabilities": ["code_analysis", "vulnerability_detection"]
      }
    ],
    "required_skills": [],
    "conflicts_with": [],
    "permission_requirements": [
      {
        "actions": ["repository.read", "code.analyze"],
        "resources": ["project:*/repository:*"],
        "conditions": {
          "environment": ["development", "staging"]
        }
      }
    ],
    "risk_level": "medium",
    "runtime_requirements": {
      "operating_systems": ["linux", "macos"],
      "binaries": ["git"],
      "network_domains": [],
      "has_scripts": false,
      "sandbox_required": false
    },
    "context_budget": {
      "max_skill_tokens": 5000,
      "max_reference_tokens": 10000,
      "max_total_tokens": 15000
    },
    "bundle_artifact_ref": {
      "kind": "Artifact",
      "id": "art_0198f6d0-7ef0-7b0e-a0d3-5f9c96c7f412",
      "digest": "sha256:c3d4e5f6a1b2c3d4e5f6a1b2c3d4e5f6a1b2c3d4e5f6a1b2c3d4e5f6a1b2c3d4"
    },
    "source_repository": {
      "repository": "https://github.com/example/skills",
      "commit": "a1b2c3d4e5f6a1b2c3d4e5f6a1b2c3d4e5f6a1b2",
      "path": "skills/code-review"
    },
    "eval_summary": {
      "trigger_precision": 0.95,
      "trigger_recall": 0.90,
      "output_pass_rate": 0.85,
      "security_passed": true,
      "regression_passed": true,
      "evaluated_cases": 50,
      "evaluated_at": "2026-09-01T00:00:00Z"
    },
    "provenance": {
      "type": "human",
      "actor": {
        "actor_type": "user",
        "actor_id": "usr_0198f6d0-7ef0-7b0e-a0d3-5f9c96c7f411",
        "tenant_id": "ten_0198f6d0-7ef0-7b0e-a0d3-5f9c96c7f411"
      }
    }
  },
  "status": {
    "phase": "active",
    "observed_revision": 1,
    "activated_at": "2026-09-01T00:00:00Z"
  }
}
